uid,body,title,url,newspaper_uid,host,n_tokens_title,n_tokens_body
cf420cbfb3743840d3b14d8dd920ca6c,"Justo cuando se esté leyendo esta nota, Bettye LaVette tal vez esté acompañada por Otis y Smokey. Y no, no se trata del lugar común de las despedidas entrañables, que honran al muerto imaginándolo como parte de una hipotética gran banda en el cielo, de la que seguramente formarían parte leyendas como Otis Redding y Smokey Robinson. Sucede que, a sus 74 años y bien viva, es probable que la cantante siga esperando el fin de la pandemia refugiada en su hogar en Nueva Jersey, acompañada por su marido y sus dos gatos, que llevan el nombre de aquellas estrellas, con los que le gusta sentarse en el jardín. O la cocina, sus dos lugares preferidos. No soy alguien con muchas habilidades, ha dicho recientemente. Se cocinar, coger y cantar. Y estoy orgullosa de las tres cosas. ","Bettye LaVette, consagrada a los 74 ",https://www.pagina12.com.ar/308442-bettye-la-vette-consagrada-a-los-74,pagina12,www.pagina12.com.ar,3,69
d7bb0a87ecddef170220aea51abaada1,"La Legislatura provincial tendrá intensa actividad hoy, en el último día de sesiones ordinarias del año, con las dos cámaras funcionando en simultáneo y haciendo lo que se conoce como ""clearing"" legislativo, que consiste en el tratamiento de leyes que salen de una cámara con media sanción y van a la de al lado para recibir sanción definitiva. Más allá de este amontonamiento de leyes que se fueron postergando durante el año y se tratan a último momento, por sobre todo destaca el proyecto de ley de Presupuesto 2021 que la Cámara de Diputados convertirá en ley esta tarde.",Día de clearing en la Legislatura,https://www.pagina12.com.ar/308886-dia-de-clearing-en-la-legislatura,pagina12,www.pagina12.com.ar,3,47
9bda88a309b7db9c755c1960ffd57309,"Primavera del 96. Era uno de esos momentos medio oscuros en la vida de Diego. Había concluido su segundo ciclo en Boca, y no andaba bien de ánimo. Puntualmente, por esos días pocos sabían qué hacía, por dónde andaba, cómo estaba de salud, hasta que un rumor empezó a circular fuerte: estaría entrenando día por medio en el Vilas Racket de Palermo, con Coppola de ladero. Al enterarse de eso, un editor de Clarín da la orden a un ignoto pasante de la sección deportes. Pedí fotógrafo, andá y sacale algunas palabras. Mandato hielasangre. No quedaba otra. Comanda en fotografía. Coche a disposición. Destino, bosques de Palermo. Tránsito espeso. Llegada. No había nadie en la puerta del Racket. Apenas un vigilante que salió de la garita para confirmar la nada misma. ¿Sabés si está Diego?, se le pregunta. Ni idea. No vi entrar ni salir a nadie, responde. Y vuelve a meterse en su cubículo feo y rectangular. La forma de comunicarse a distancia, a fines del siglo pasado, era a través de unos inmensos mamotretos grises, al que solía llamarse Movicom. El pasante activa el aparato entonces, y pasa el dato al editor. La respuesta es inflexible. Diego está ahí, espérenlo afuera, le sacan unas palabras, unas fotos y se vienen con algo.",Diego Maradona: No quiero persecuta,https://www.pagina12.com.ar/308879-diego-maradona-no-quiero-persecuta,pagina12,www.pagina12.com.ar,3,112
845e23c66d62929a7412702a8bff5fe6,"Mientras que aquí Mauricio Macri y algunos periodistas atrincherados en sus bolsillos decían (lo repiten) que su meritocracia de hijos de millonarios es la única forma en que los mejores lleguen al gobierno. Es un eslogan desmentido por el mismo Macri, cuya única cualidad para gobernar fue su propio bolsillo aplastando los bolsillos del país y de los demás y no mostrando ninguna cualidad meritocrática, más bien al contrario. ",Meritocracia y capitalismo,https://www.pagina12.com.ar/308076-meritocracia-y-capitalismo,pagina12,www.pagina12.com.ar,2,37
6f18ab53de43806f970cf3505f80bf99,"A cinco días de la muerte del astro futbolístico, las repercusiones se siguen multiplicando. Este lunes, en la Ciudad Autónoma de Buenos Aires, el Frente de Todos presentó en la Legislatura porteña un proyecto para reemplazar el nombre de un tramo de las calles Boyacá y Punta Arenas por el de ""Diego Armando Maradona"" y crear un ""circuito turístico, deportivo y cultural"" a cielo abierto en La Paternal.",Proponen crear un circuito turístico en La Paternal en homenaje a Diego Maradona,https://www.pagina12.com.ar/309035-proponen-crear-un-circuito-turistico-en-la-paternal-en-homen,pagina12,www.pagina12.com.ar,8,36
460521e2cec924016ec706cff29648d1,"Hace apenas algunos días circuló la foto de un mural sirio dedicado a Diego Maradona pintado tras su muerte. La obra pertenece a Aziz-Al Asmar, artista callejero que deja su estampa entre los azotes de la guerra civil que ya lleva casi una década. Ese mismo extrañamiento y cercanía es lo que intenta generar No Mans Land, la serie de ocho episodios estrenada la semana pasada por STARZPLAY.","""No man's land"", la sangre derramada",https://www.pagina12.com.ar/308858-no-mans-land-la-sangre-derramada,pagina12,www.pagina12.com.ar,4,39
492312428aa71d2f6b2746ded66390fd,"El Gobierno prorrogó nuevamente, hasta el 25 de enero próximo, la doble indemnización a la que tendrán derecho los trabajadores en el caso de despido, en el marco de la ""emergencia ocupacional"" que rige desde el inicio de la gestión del Frente de Todos y que se extendió por la pandemia de coronavirus.  ""Amplíase hasta el 25 de enero de 2021 la emergencia pública en materia ocupacional declarada el 13 de diciembre de 2019 y ampliada el 9 de junio de 2020"", apunta el decreto 961, firmado por el presidente Alberto Fernández y sus ministros, y publicado en el Boletín Oficial. En ese sentido, la medida establece que ""en caso de despido sin justa causa, la trabajadora afectada o el trabajador afectado tendrá derecho a percibir el doble de la indemnización"".",Doble indemnización sigue en 2021,https://www.pagina12.com.ar/309071-doble-indemnizacion-sigue-en-2021,pagina12,www.pagina12.com.ar,3,55
681a5d4784825abd79e856e42b6fcb02,"Una máxima literaria bastante aceptada y difundida es que nada bueno sale de un panfleto. Es decir: nada bueno surge del acto proselitista que contrabandea causas a través de la literatura. Tundra, el libro debut de la británica Abi Andrews que acaba de ser editado en Argentina por Chai, rompe con esa premisa y se ríe de ella. No por panfletario, sino por comprometido. ""No es un manifiesto"", le dijo la autora a El NO, desde un paraje rural de Australia. ""Pero es el modo en el que puedo decir aquello que me preocupa o interesa.""","""Tundra habla de los temores de ser mujer y volverse adulta""",https://www.pagina12.com.ar/307620-tundra-habla-de-los-temores-de-ser-mujer-y-volverse-adulta,pagina12,www.pagina12.com.ar,7,46
f6c365e345989e32f72b43135ff9ea97,"Trabajamos para que estas sean vacaciones protegidas, en las que se cuide a quienes veranean y a quienes viven aquí, aseguró el gobernador Axel Kicillof después de reunirse con intendentes de municipios que recibirán al turismo en el verano. Además recorrió el avance de obras en las rutas 11 y 56, que se transformarán en autovías y también se reunió con trabajadores de la temporada, como los colaboradores de playa que promoverán los protocolos en la temporada que comienza el martes.",Kicillof afina detalles para la temporada de verano,https://www.pagina12.com.ar/309088-kicillof-afina-detalles-para-la-temporada-de-verano,pagina12,www.pagina12.com.ar,5,33
573b585a3a05c5298b100843a16e3fb1,"Según se desprende de un estudio realizado por la mayor especialista entre los vínculos entre Argentina y el FMI, la doctora en Economía e investigadora del Conicet Noemí Brenta, desde 1956 hasta la actualidad Argentina suscribió 24 acuerdos de fuerte condicionalidades con el organismo multilateral. Pero solo dos de ellos fueron de Facilidades Extendidas o Extended Fund Facility (EFF), justamente durante la década del noventa, puntualmente en 1992 y 1998. ",Las claves de la negociación con el FMI,https://www.pagina12.com.ar/308298-las-claves-de-la-negociacion-con-el-fmi,pagina12,www.pagina12.com.ar,3,33
c681180447f5eeec734d4d919cd95447,"Los Pumas no homenajearon a Diego Maradona en el partido del sábado. Los All Blacks, sí.","La ovalada no se mancha, su dirigencia sí",https://www.pagina12.com.ar/309089-la-ovalada-no-se-mancha-su-dirigencia-si,pagina12,www.pagina12.com.ar,3,8
8f7cd6bbecb615b33a4543746b38d347,"La vida pasa junto a los muros de la cárcel que cada uno se ha fabricado. Son muros de interior donde las inclemencias del prójimo habitan como espectros que parecen hologramas. Demonios sin domesticar, donde la crecida de la barbarie edifica infiernos íntimos, de sangre seca. A Diego Latorre el infierno se le presentó como un crujido seco, indómito, cercano. Le zarandeó los tuétanos en una realidad fáustica, desfigurada, y en medio de la desolación, como Alicia al otro lado del espejo, se quedó cautivo para siempre en el poema de la razón: el lugar más hermoso para refugiarse. Pidió perdón, lloró en silencio, decidió perder el mundo de vista, y como un ser indiferenciado esperando a Godot, con el tiempo por delante fue en busca de una sola emoción: leerse a sí mismo.","Diego Latorre: ""Soy de izquierda, de pañuelo verde y de eutanasia legal""",https://www.pagina12.com.ar/308801-diego-latorre-soy-de-izquierda-de-panuelo-verde-y-de-eutanas,pagina12,www.pagina12.com.ar,7,69
5482f1052a445b20de2f7c9a15377b1d,"Susy Shock custodia una tradición artística que encuentra un faro en Leda Valladares, la cantora tucumana en gran medida responsable de trasplantar el canto con caja a Buenos Aires. Además de ser la coplera más queer, Susy es también alguien que desde fines de los noventa no ha parado de invocar al futuro con su pluma y su voz, y de hacer de ella un arma cargada. Decía en Catacumbas (2007): Todavía no es tiempo /Estamos en catacumbas /y desde allí olemos, conspiramos /tejemos /y nos reproducimos /Estamos detalladamente/ haciendo la poesía /de los nuevos tiempos. Ahora su poesía reunida en Realidades, está a punto de desembarcar en librerías. Desde allí les habla a las infancias latinoamericanas de un modo similar al que lo hacía en Crianzas, un manifiesto amoroso con relatos y mensajes de una tía trava a su sobrino Uriel, también editado por Muchas nueces. Entre recuperados e inéditos, Realidades, contiene alrededor de 300 poemas y escritos presentes en Poemario Transpirado, Revuelo Sur, Relatos en canecalón. De yapa: las imágenes de la obra Kamasutra, de León Ferrari, y de Noy, que ilustró a la autora. ",Susy Shock: Monstrua de mi deseo,https://www.pagina12.com.ar/308031-susy-shock-monstrua-de-mi-deseo,pagina12,www.pagina12.com.ar,4,93
f103092792c124e8254134df0685ca85,Me llamo Dario Argento.,"""Paura"", la autobiografía de Dario Argento",https://www.pagina12.com.ar/306845-paura-la-autobiografia-de-dario-argento,pagina12,www.pagina12.com.ar,4,3
28ee722f56917a523aebb299162efdf7,"Como uno de los máximos referentes del Frente de Todos en Salta, repitió hasta el cansancio que ese es un premio que obtuvo por su acompañamiento incondicional al espacio que condujeron Néstor Kirchner y Cristina Fernández, y si bien realizó alguna autocrítica en cuanto a la estrategia utilizada para las elecciones provinciales 2019, aseguró que tiene apertura y que habló con todos los espacios que integran el Frente para limar diferencias.","Soy el presidente del PV, no conduzco todo el Frente",https://www.pagina12.com.ar/308973-soy-el-presidente-del-pv-no-conduzco-todo-el-frente,pagina12,www.pagina12.com.ar,3,34
f0d87fe20df3f109a6cc45c2a9717b60,"Había una vez una niña inglesa llamada Robyn Goodfellowe. Robyn es una chica inquieta y corajuda que, sin que nadie lo sepa, practica en sus tiempos libres el tiro con ballesta. Corre el año 1650 de nuestro Señor y la vida en el poblado irlandés de Kilkenny al cual acaba de mudarse junto a su padre, el cazador de lobos Bill Goodfellowe, no es sencilla. Su origen es motivo de recelo y burla y la aldea, fuertemente fortificada para impedir el ataque de los animales salvajes, es lo más parecido a una prisión. Desoyendo por completo los consejos de su progenitor, un buen día la chica decide cruzar la frontera prohibida y adentrarse en la espesura del bosque cercano, desconocedora de que allí, escondida entre los árboles, camina Mebh MacTíre, una niña de su misma edad y cabellera roja como el fuego que, en ciertos momentos y a voluntad, puede transformarse en lobo. Mebh es una wolfwalker, una paseadora de lobos, criatura mitad humana y mitad lobezno capaz de conducir a toda una manada de canis lupus. Hija de una mujer que, tiempo atrás, también cayó en el hechizo, condenada a no poder recuperar su forma original jamás de los jamases. A menos que Así comienza el cuarto largometraje de Cartoon Saloon, la productora independiente irlandesa con sede en la cervecera ciudad de Kilkenny dedicada exclusivamente a la animación, cuyos logros artísticos han ido de la mano de la aceptación de la industria cinematográfica más poderosa del mundo: sus tres títulos previos fueron nominados a un premio Oscar en la categoría correspondiente. En 2018, el Bafici le dedicó un foco que incluyó la exhibición de esos tres largometrajes: The Secret of Kells, Song of the Sea (ambas dirigidas por Tomm Moore) y The Breadwinner, esta última bajo la realización de Nora Twomey y disponible en la plataforma Netflix.","""Wolfwalkers"", cine  de animación irlandés para el mundo",https://www.pagina12.com.ar/307766-wolfwalkers-cine-de-animacion-irlandes-para-el-mundo,pagina12,www.pagina12.com.ar,5,168
00bbd6d90a292002aa3d4c2bbaf3306e,"No es novedad que nuestros teléfonos celulares exploran funcionalidades cada vez más precisas y bien articuladas en lo que respecta a la creación, edición y difusión de contenido. Tomando como punto de partida estos desarrollos, en especial los teléfonos celulares y su capacidad como herramientas para la creación audiovisual, la plataforma Spam Arts inicia hoy sus actividades como una de las principales atracciones dentro de la celebración Noviembre Electrónico, en la ciudad de Buenos Aires.",Spam Arts: el teléfono móvil como herramienta de creación,https://www.pagina12.com.ar/307747-spam-arts-el-telefono-movil-como-herramienta-de-creacion,pagina12,www.pagina12.com.ar,6,41
8b1851dca80f9205c298d7605296702e,"La pesadumbre fue masiva, acaso mayoritaria. Diego Armando Maradona hizo felices a millones de argentinos de distintas generaciones que vibraron y gozaron gracias a él. Ahora lo lloran sin disimulos. Como jugador trascendió sus dotes de crack. Capitán, referente, caudillo, un hincha más dentro la cancha, altruista aparte de dotado. El segundo golazo a los ingleses habla de él tanto como el primero y como el tobillo hecho un Big Mac en el Mundial de Italia. Por entonces, en varios partidos exigió sobrehumanamente a su cuerpo sin hacerle caso a los médicos ni al sentido común privilegiando su misión sobre el dolor. Colgó al equipo sobre sus hombros de gigante retacón. Sus compañeros lo admiran por su talento tanto como por la generosidad en la cancha. Tanta garra como calidad, un prodigio.",La despedida colectiva a Diego Maradona,https://www.pagina12.com.ar/308712-la-despedida-colectiva-a-diego-maradona,pagina12,www.pagina12.com.ar,4,70
e10a4ac174c494c9743143a18f458cc3,"Estimada Gabriela, espero que se encuentre muy bien a pesar de lo difícil de los tiempos que corren. Seguramente la sorprenderá esta carta que envío por email. Diligentes amigas me han hecho llegar su artículo de Página12. Leo allí que usted recibió un libro con cartas que intercambiaron dos mujeres, y que el libro llegó con una promesa: ""hay un intenso erotismo en esta correspondencia"". Según dice en su artículo, a usted no le interesaron las protagonistas, Victoria Ocampo y Virginia Woolf, lo que la movió a verlo, le dio ""ganas"" (palabra muy de Victoria) fue ""descubrir ese romance, esa carga erótica prometida"". Me hubiera gustado que hablemos sobre el tema, pero entre otras cosas debemos mantener la denominada distancia social. Así que por medio de este mensaje/email, heredero de las cartas que ya no suelen enviarse, quiero compartir con usted algunas consideraciones sobre la relación de Woolf y Ocampo; y sobre el ""intenso erotismo"" que le habían prometido encontraría en su correspondencia. ",Victoria y Virginia: leyendo entre líneas,https://www.pagina12.com.ar/307765-victoria-y-virginia-leyendo-entre-lineas,pagina12,www.pagina12.com.ar,4,82
06a475001ad8fba4c9f5f315b49dc0c7,"Un enorme patio en el barrio de Caballito, al fondo de un edificio. Sentades en el piso y a un metro de distancia, Paula Trama y Dante Frágola hablan con El NO sobre Los Besos, un grupo que logró consolidar y expandir su propuesta musical partiendo de la tradición del pop pero a la vez huyendo de las etiquetas. La suya no es música complaciente ni se rige por la lógica de la gran industria. Tiene otros tiempos. De alguna manera, ocupan un lugar intermedio: entre el circuito comercial y los centros culturales de base. Pueden llenar una sala como el Xirgu, pero también sonar en un festival comunitario o una casa cultural.","""El estado ideal de Los Besos es en un estudio de grabación""",https://www.pagina12.com.ar/308479-el-estado-ideal-de-los-besos-es-en-un-estudio-de-grabacion,pagina12,www.pagina12.com.ar,4,54
f19182e2e253b60e5a0a82fdfda73b38,"Los Pumas quedaron en el ojo de la tormenta por no haber homenajeado a Diego Maradona antes o después del partido del sábado que perdieron 38-0 ante los All Blacks, que por el contrario habían conmovido al mundo por ofrendar una camiseta negra con el número 10 y el apellido Maradona, e incluir al ídolo fallecido en su tradicional ""haka"". Por ello, el seleccionado argentino de rugby pidió disculpas por la omisión, a través de un video en el que el capitán Pablo Matera habló en nombre de todo el plantel. ",Las disculpas de Los Pumas por no homenajear a Maradona,https://www.pagina12.com.ar/309009-las-disculpas-de-los-pumas-por-no-homenajear-a-maradona,pagina12,www.pagina12.com.ar,4,43
8c813d770420e01b5bc9cccb749137ac,"Miembros de organizaciones antiderechos sumaron otro acto de intimidación contra quienes apoyan la legalización del aborto que se tratará en el Congreso. Esta vez fue contra la diputada del Frente de Todos Carolina Gaillard, aunque no directamente contra ella sino contra su madre y su padre, en el comercio familiar que tienen en la localidad de Entre Ríos.",Escrache antiderechos a la diputada Carolina Gaillard,https://www.pagina12.com.ar/308991-escrache-antiderechos-a-la-diputada-carolina-gaillard,pagina12,www.pagina12.com.ar,5,25
56e7334c5d7683b9fc47518c9d8ef378,1 - Por el gran amor que tuviste siempre por tus seres queridos.,Gracias Diego,https://www.pagina12.com.ar/309038-gracias-diego,pagina12,www.pagina12.com.ar,2,5
f371e5ef9de88195153b8d7b34a133b7,"A los catorce años, no bien ingresó al proyecto de arte comunitario Circuito Cultural Barracas, a Bárbara Aguirre se le manifestó el futuro. Hoy tiene treinta y nueve, y no paró. Canta muy bien, pero no solo. También actúa, baila, escribe poesías, produce discos, es DJ, da reiki, es docente, psicoanaliza, milita en el colectivo Tango Hembra, compone músicas desde un bombo con platillo y claro-- la murguea a morir. Sí parto de la murga y después viene todo el Río de la plata y el arrabal son los paisajes que me gusta cantar, resume ella ante PáginaI12. Ese todo sigue incluyendo actividades: de ser la pata femenina de un formidable dúo junto a Juan Lorenzo, hasta colocar su voz al servicio del cuarteto Las Orillas, pasando por El Gran Capitán Afrobeat, su grupo solista La Soñadora, Gualicho Turbio, Manchesta, In Fusión, Barbie & White, y Candombea, flamante banda de música rioplatense que acaba de armar junto a la guitarrista Lina Agrima y las tamborileras Natalia Alfi, Johanna Garín y Patricia Muñoz. De ellas se trata lo inmediato, porque se las podrá ver en acción este lunes a las 21 en el facebook de Container Cultural MRP.","Bárbara Aguirre: ""Parto de la murga y después viene todo""",https://www.pagina12.com.ar/308868-barbara-aguirre-parto-de-la-murga-y-despues-viene-todo,pagina12,www.pagina12.com.ar,6,110
2a8272fecb757a1452990dae4bfcb17a,"Aunque la experiencia de seguir los conciertos a través de una pantalla estuvo lejos del vértigo festivalero que producía tener que ir a las apuradas de una sala a otra, intercambiar breves impresiones con conocidos y extraños, tomar una cerveza a las apuradas, tirar el pucho por la mitad porque ya larga el concierto siguiente para acomodarse en una butaca escuchando aquellas saludables toses propias y ajenas, la densidad musical y la coherencia de la programación le dieron a la edición 2020 del Buenos Aires Jazz aire de festival. Acotado por las urgencias socio-sanitarias a dos días de actividades sábado y domingo y salvo dos conciertos al aire libre, obligado a volcarse en el recipiente de la grabación para llegar a través del streaming, el mayor encuentro de jazz del país dejó de todas maneras cierta sensación de felicidad. ",Buenos Aires Jazz: felicidad a pesar de todo,https://www.pagina12.com.ar/309067-buenos-aires-jazz-felicidad-a-pesar-de-todo,pagina12,www.pagina12.com.ar,5,74
4d4a99c2e14f96beba6cfcf64da2c997,"Todos Comen es un espacio que vincula a productores populares de alimentos y consumidores. Creado hace dos años, encara en estos días una nueva etapa, la de empezar a comercializar puerta a puerta, llevando a domicilio productos de empresas familiares, cooperativas y  empresas recuperadas. Un imaginario instalado nos dice que comprar por esta vía de las comercializadoras alternativas es comprar más barato: si se vende sin intermediarios, los precios deberían bajar. Pero la idea necesita ser dotada de mayor complejidad si se quiere que aguante el peso de lo real. Para el consumidor, comprar a una comercializadora alternativa es sumarse a un proyecto que lo va a conducir a productos de cooperativas y pequeñas empresas; saber que su dinero se va a destinar en un 80 por ciento a retribuir al productor...y finalmente comprar sin pagar más que en un supermercado. Y eso es muchísimo, asegura Enrique Martínez.","Qué es Todos Comen, el sitio web para comprar comida que vincula a productores populares y consumidores",https://www.pagina12.com.ar/309037-que-es-todos-comen-el-sitio-web-para-comprar-comida-que-vinc,pagina12,www.pagina12.com.ar,9,79
f8accfc8716e85df3f040d6e4845380f,"La caída de meteoritos- de tamaños pequeños-, sobre la Tierra es un fenómeno bastante común. Sin embargo, muy pocas veces queda registrado en imágenes. Esta vez, en Japón se pudo capturar el momento en el que el astro ingresó en la atmosfera..",Un meteorito atravesó la atmósfera y cayó en Japón,https://www.pagina12.com.ar/308866-un-meteorito-atraveso-la-atmosfera-y-cayo-en-japon,pagina12,www.pagina12.com.ar,5,20
71a5d95e9069203b1c14f6804c4e60ac,"En paralelo a la legalización del autocultivo de cannabis con fines medicinales por parte del Gobierno, la Universidad Nacional de Quilmes (UNQ) presentó el Diploma de Posgrado en Cannabis, Regulación y Políticas de Drogas, que plantea un abordaje multidisciplinario para comprender el paradigma prohibicionista alrededor de la planta y profundizar el conocimiento y la divulgación científica sobre los usos, las posibilidades y los sistemas regulatorios.",Abren un posgrado sobre cannabis en Quilmes,https://www.pagina12.com.ar/307946-abren-un-posgrado-sobre-cannabis-en-quilmes,pagina12,www.pagina12.com.ar,4,35
7ae26ebb376d4fd140dbb3773aa9f647,"Luego de los escraches y actos intimidatorios que las organizaciones antiderechos concretaron contra legisladores que apoyan el proyecto de Interrupción Voluntaria del Embarazo (IVE), la Cámara de Diputados constituyó un cuerpo de abogados para garantizar la defensa de la intimidad y la libertad de cada legislador para expresar su opinión.",Aborto legal: Diputados busca poner un límite a los escraches celestes,https://www.pagina12.com.ar/308997-aborto-legal-diputados-busca-poner-un-limite-a-los-escraches,pagina12,www.pagina12.com.ar,8,27
15c06183b450884bbe319beffeb06606,"El abogado de la enfermera Dahiana Gisela Madrid, quien reveló inconsistencias en la atención médica de los últimos días de Diego Maradona, reveló que el ídolo futbolístico tuvo una caída en la que se golpeó la cabeza una semana antes de su muerte y no fue llevado a realizarse chequeos, a pesar de que antes había sido operado por un hematoma subdural. ",La enfermera dijo que Maradona se golpeó la cabeza una semana antes de morir,https://www.pagina12.com.ar/308998-la-enfermera-dijo-que-maradona-se-golpeo-la-cabeza-una-seman,pagina12,www.pagina12.com.ar,7,29
d4e123e8a404bebb199a8fe684768e3d, ,Lidera el rebote a nivel nacional,https://www.pagina12.com.ar/308859-lidera-el-rebote-a-nivel-nacional,pagina12,www.pagina12.com.ar,4,0
